{"policy_snapshot_id":"psn_fixture","policy_bundle":{"policy_bundle_id":"pob_fixture","hash":"aaaaaaaaaaaaaaaaaaaaaaaaaaaaaaaaaaaaaaaaaaaaaaaaaaaaaaaaaaaaaaaa","selected_lesson_ids":[],"role_directives":[],"exclusions":[],"rationale":"Policy-independent baseline for this evaluated run.","maximum_character_count":1,"constitution_version":"1.0.0"},"constitution_version":"1.0.0","created_at":"2026-07-28T00:00:00Z"}
